{
  "schema_version": "1.0",
  "id": "source",
  "title": "source",
  "language": "en",
  "questions": [
    {
      "schema_version": "1.0",
      "id": "q1",
      "type": "short_answer",
      "language": "en",
      "stem": {
        "blocks": [
          {
            "type": "text",
            "text": "Select the synthetic prime from this nested list.\n  \\begin{enumerate}\n  \\item Four\n  \\item Five\n  \\end{enumerate}"
          }
        ]
      }
    },
    {
      "schema_version": "1.0",
      "id": "q2",
      "type": "short_answer",
      "language": "en",
      "stem": {
        "blocks": [
          {
            "type": "text",
            "text": "State whether six is even."
          }
        ]
      }
    }
  ]
}
