{
  "schema_version": "1.0",
  "id": "markdown-answer-marker",
  "title": "Synthetic answer marker",
  "language": "en",
  "questions": [
    {
      "schema_version": "1.0",
      "id": "answer-marker-001",
      "type": "short_answer",
      "language": "en",
      "stem": {
        "blocks": [
          {
            "type": "text",
            "text": "Before the synthetic marker.\n**Answer:** `{\"kind\": \"text\", \"value\": \"synthetic\"}`\nThis remains stem text.\n\\**Answer:** `{\"kind\": \"text\", \"value\": \"escaped\"}`"
          }
        ]
      }
    }
  ]
}
